<?xml version="1.0" encoding="UTF-8"?>
<multas xmlns:xsi="http://www.w3.org/2001/XMLSchema-instance"
 xsi:noNamespaceSchemaLocation="ejercicio7.xsd">

    <!-- Creo localidades para relacionar con keyref-->
    <localidades>
        <localidad cod="MAD">Madrid</localidad>
        <localidad cod="BAR">Barcelona</localidad>
    </localidades>

    <multa expediente="E44570" codLocalidad="MAD">
        <matricula>3465BDZ</matricula>
        <tipo>Exceso de velocidad</tipo>
        <importe>120.50</importe>
        <fecha>2015-05-07</fecha>
        <lugar>Calle Anastasia 43</lugar>
        <observaciones>Zona muy transitada</observaciones>
        <pagada>no</pagada>
    </multa>
    <multa expediente="E44571" codLocalidad="BAR">
        <matricula>8890JFK</matricula>
        <importe>120</importe>
        <fecha>2015-05-07</fecha>
        <lugar>Calle Anastasia 43</lugar>
        <tipo>Estacionamiento carril bus</tipo>
        <pagada>SI</pagada>
    </multa>
</multas>